TIPO;CATEGORIA;TAREA;DESCRIPCIÓN;VARIANTES;OBJETIVO;ESPACIO;TIEMPO TOTAL;MATERIAL;VIDEO DRIVE ID
PORTEROS;INFANTIL , ALEVIN , BENJAMIN;VELOCIDAD DE REACCIÓN Y DESPLAZAMIENTO (2);"El portero se sienta sobre una pelota de Fitball (apoyando los pies en el suelo y formando un ángulo recto con las rodillas). Delante de este, se sitúa un compañero para lanzar un disparo frontal para realizar un blocaje y otro compañero a un lado del lanzador.
Tras el blocaje, el portero se levanta y realiza un saque con la mano al compañero situado al lado del lanzador.
Rápidamente, el entrenador de porteros y ayudado por una raqueta o pala de pádel, realiza un golpeo de una pelota de tenis a media altura, para que realice una intervención de desvío con caída lateral.
Prestando atención a la reincorporación, (realizando un cambio de pesos en la caída o aplicando la técnica correcta para levantarse de forma lateral) el portero se dirige hacia un balón aéreo lanzado por el compañero al que le dio el balón al iniciar el ejercicio.";;DESPLAZAMIENTO;10x10;10;BALONES , CHINOS , PICAS , FITBALL , PELOTAS TENIS , PALA PADEL;
PORTEROS;INFANTIL , ALEVIN , BENJAMIN;PROLONGACIONES (1);1.    El entrenador de porteros golpea un balón frontal para blocaje y devolución. 2.    De nuevo, golpeo pero esta vez para blocaje con caída lateral y devolución. 3.    Desplazamiento rápido por detrás del cono para realizar una prolongación por encima del larguero. 4.    Desplazamiento rápido para afrontar situación de 1x1. 5.    Pase desde la línea de fondo entre compañeros para generar una situación de 1x1.;;PROLONGACIONES;Portería competición;10;BALONES , CHINOS;
PORTEROS;INFANTIL , ALEVIN , BENJAMIN;PROLONGACIONES (2);"1.    El portero que trabaja realiza una pequeña carrera (de 3 metros aproximadamente) hasta situarse en la mini portería de conos, donde el entrenador de porteros golpeará 1 balón piramidal que este deberá desviar.
2.    Tras esta acción, un compañero situado a la derecha del entrenador, realiza un golpeo tenso a media altura a otro compañero situado en la línea de fondo.
3.    El portero que está realizando el trabajo, realiza un desplazamiento para situarse en la posición correcta según la posición del balón.
4.    El compañero lanzará un balón aéreo hacia el segundo palo.
5 y 6.  Desplazamiento correcto para desviar el balón";;PROLONGACIONES;Portería competición;10;BALONES , CHINOS;
PORTEROS;INFANTIL , ALEVIN , BENJAMIN;DESPLAZAMIENTOS (1);El portero inicia una pequeña carrera hacia el entrenador de porteros, el cual, realiza un pase raso para que este golpee al primer toque con el objetivo de marcar gol en la mini portería.  Tras el golpeo, se realizan 4 saltos en la cinta (dos a cada lado) para terminar con un lanzamiento raso en el que el portero realizará un blocaje lateral.  Rápidamente, deja el balón y volveremos a lanzar otro balón al lado contrario, esta vez, a media altura para blocaje lateral.;;DESPLAZAMIENTO;10x10;10;BALONES , CHINOS , PICAS , VALLAS , CINTA;
PORTEROS;INFANTIL , ALEVIN , BENJAMIN;DESPLAZAMIENTOS (2);"Un compañero se sitúa dentro de la portería con un balón. 
Cuando él decida,  realizará un pase al entrenador de porteros el cual golpeará el balón al primer toque.
El portero deberá reaccionar y realizar un desvío. Rápidamente, se levanta y se posiciona para blocar un balón aéreo y hacer un saque raso hacia una mini portería. 
Tras esta acción, se posiciona en el primer palo, y aguantará a otro compañero que el disparo a puerta. 
Este realizara un pase atrás para que el entrenador golpee a puerta al primer toque.";;DESPLAZAMIENTO;Portería competición;10;BALONES , CHINOS , PICAS , VALLAS;
PORTEROS;INFANTIL , ALEVIN , BENJAMIN;DESPLAZAMIENTOS (3);"El portero inicia el ejercicio desde un poste. Un compañero lanzará un balón para que este salga y realice un despeje con la cabeza. 
El balón deberá lanzarse lo más frontal posible para que nuestro portero, realice un giro con el cuello y dirija el balón a zonas seguras. 
Tras esta acción deberá recorrer las picas situadas en el área pequeña. Siempre mirando al campo, es decir, de forma que todo lo que ocurra dentro del campo, pueda ser controlado. 
Al salir de las picas, realizará una carrera a tocar el palo y recibirá un disparo para blocaje lateral.";;DESPLAZAMIENTO;Portería competición;10;BALONES , CHINOS , PICAS;
PORTEROS;INFANTIL , ALEVIN , BENJAMIN;DESPLAZAMIENTOS (4);"Misma disposición que el ejercicio anterior pero introduciendo aros y escalera. Partiendo de un palo, un compañero lanzará un balón para provocar una acción técnica, esta será devolver el balón al compañero realizando un golpeo a media altura con el interior del pie. 
Rápidamente, carrera hacia atrás para desviar el balón lanzado por este mismo compañero. La siguiente acción consiste el realizar una carrera frontal pisando dentro de los aros situados en el suelo. 
Tras salir del último aro, comenzamos otro trabajo de frecuencia con escalera que terminará en línea de gol. 
Aquí, comenzamos el último trabajo de frecuencia, carrera frontal en zig-zag evitando picas para terminar con un disparo frontal.";;DESPLAZAMIENTO;Portería competición;10;AROS , BALONES , CHINOS , PICAS , ESCALERA COORDINACION;
PORTEROS;INFANTIL , ALEVIN , BENJAMIN;BLOCAJES + DESPLAZAMIENTOS (1);Inicia el ejercicio P1 con una escalera de frecuencia. A la salida de la misma, el entrenador de porteros EP lanza un balón aéreo que blocará P1.  Tras el blocaje aéreo, realizará un saque raso a una mini portería de conos. Rápidamente, tendrá que evitar que el EP golpee con el balón una pica sobre un cono y después de esta acción, parar un disparo también de EP a una mini portería de picas.  VARIANTE: En la primera acción de la escalera de frecuencia, podemos realizar muchos tipos de apoyos, como por ejemplo, todas las pisadas por dentro, pisar dentro y fuera, pisada lateral por dentro, dos dentro una fuera… cualquier acción restante, podemos modificar su lanzamiento, podrá ser con la mano, con el pie, picado, raso…;;BLOCAJES;Portería competición;10;BALONES , CHINOS , PICAS , ESCALERA COORDINACION;
PORTEROS;INFANTIL , ALEVIN , BENJAMIN;BLOCAJES + DESPLAZAMIENTOS (2);"Comienza el ejercicio pasando por delante de una pica y blocando un balón lanzado por el EP a media altura. P1 se reincorpora y pasa por detrás de la pica para recibir un balón raso de P2 y devolver con toque de primeras. 
Posteriormente, rodeará la segunda pica y blocará un balón picado lanzado por P3.

VARIANTE:
Todos los golpeos, tanto la primera acción como la tercera, podemos variar el estilo de lanzamiento de balón por golpeo a media altura, raso, saque con la mano picado, alto…
 La segunda acción, podemos sustituirla por un balón aéreo.";;BLOCAJES;Portería competición;10;BALONES , CHINOS , PICAS;
PORTEROS;INFANTIL , ALEVIN , BENJAMIN;EJERCICIO DE VELOCIDAD DE DESPLAZAMIENTO Y COORDINACIÓN (1);El portero con un balón en las manos, inicia el ejercicio desde un poste.  Realiza una carrera hacia el otro lado, planta el balón en el suelo y rápidamente corrige la posición para desviar un tiro que ejecuta el entrenador de porteros.  Después del desvío, se reincorpora y realiza un golpeo al balón plantado previamente. (otro compañero se coloca a la altura de la portería de F7, pero adecuar según años y nivel) Realizar sobre los dos perfiles (lado izquierdo y lado derecho);;VELOCIDAD DESPLAZAMIENTO;Portería competición;10;BALONES , CHINOS;
PORTEROS;INFANTIL , ALEVIN , BENJAMIN;EJERCICIO DE VELOCIDAD DE DESPLAZAMIENTO Y COORDINACIÓN (2);"Montaremos dos porterías con conos y picas de unos 5 metros aproximadamente y separadas unos 3-4 metros. 
En cada cono se sitúa un portero, así que trabajarán 4 porteros activamente y otros 4 golpeando por fuera de las porterías. 
El ejercicio es simétrico en ambas porterías, por lo que también entra en juego la coordinación de los que lo realizan. P1 y P2 se cruzan para blocar los disparos de EP1 y EP2. 
Al mismo tiempo, comienzan P3 y P4 de la misma manera, cruzando y blocando los disparos de EP3 y EP4. Después del blocaje, dejan el balón y realizan una carrera hasta el cono cercano al poste de la portería, lo rodean y siguen hasta la otra portería. 
En cuanto están los 4 porteros en disposición, volvemos a iniciar los disparos.
Realizar sobre los dos perfiles (lado izquierdo y lado derecho)";;VELOCIDAD DESPLAZAMIENTO;Portería competición;10;BALONES , CHINOS , PICAS;
PORTEROS;INFANTIL , ALEVIN , BENJAMIN;EJERCICIO LECTURA DEFENSIVA (1);P1 inicia el ejercicio con un golpeo con el interior del pie a uno de los compañeros que forman la línea defensiva de 4, en este caso, a P2. Estos realizarán pases entre ellos hasta que uno decida jugar con el entrenador de porteros EP.  En ese momento, los porteros que actúan de centrales, P3 y P4 pasan a ser atacantes, y los laterales P2 y P5 pasan a ser defensores.  El EP lanzará un balón a una zona media donde P1 deba tomar una decisión, interpretar el juego y realizar una lectura defensiva para salir a despejar el balón o aguantar en la portería. ATENCIÓN: Debemos fijarnos en la colocación previa a la toma de decisiones, que el portero este bien colocado. Como siempre os comento, el objetivo es la lectura defensiva pero no por eso, debemos dejar de lado el inicio de la jugada, los pases entre porteros…;;LECTURA DEFENSIVA;Portería competición;10;BALONES , CHINOS;
PORTEROS;INFANTIL , ALEVIN , BENJAMIN;EJERCICIO LECTURA DEFENSIVA (2);"P1 inicia el ejercicio con un golpeo con el interior del pie a P2. Este le devuelve el balón y P1 realiza un golpeo con el empeine a P3. 
Este conducirá el balón hacia línea de fondo y realizará un centro. P1 bloca en juego aéreo y saca de semi-volea a EP. 
El entrenador de porteros golpeará un balón dividido entre P1 y P4. P1 tendrá que decidir cómo actuar.

ATENCIÓN:
Debemos fijarnos en la colocación previa a la toma de decisiones, que el portero este bien colocado. Como siempre os comento, el objetivo es la lectura defensiva pero no por eso, debemos dejar de lado el inicio de la jugada, los pases entre porteros, saques, blocajes aéreos…";;LECTURA DEFENSIVA;Portería competición;10;BALONES , CHINOS;
PORTEROS;INFANTIL , ALEVIN , BENJAMIN;EJERCICIO LECTURA DEFENSIVA (3);"1 y 2. Inicia el ejercicio el portero que se encuentra en la portería, realizando un pase con el interior a otro compañero. Este se la devuelve a un toque, dependiendo de la edad y nivel.
3. Tras un control orientado, el portero realiza un golpeo con el empeine a otro compañero situado en la otra banda del campo.
4 y 5. Este realizará una conducción y realizará un centro al área.
6. Tras el blocaje aéreo, realizará un saque de volea al entrenador de porteros, quien controlará y lanzará un balón dividido entre el portero y un compañero que actuará de delantero.
7 y 8. El portero y el delantero tratarán de cumplir su objeto, el delantero marcar gol y el portero evitarlo. El portero deberá medir su salida para garantizar el despeje o bien, mantenerse colocado y recibir al delantero en un 1x1.";;LECTURA DEFENSIVA;Portería competición;10;BALONES , CHINOS;
PORTEROS;INFANTIL , ALEVIN , BENJAMIN;EJERCICIO LECTURA DEFENSIVA (4);"1. El entrenador de porteros realiza una circulación de balón en la frontal del área con 2 porteros. Podrá ejecutar tantos pases como crea necesario. Por detrás de estos, se situarán otros dos que actuarán de delanteros. 
 2 y 3. Cuando uno de los compañeros situados por detrás de los “centrales” realice un desmarque hacia portería, el entrenador realizará un pase en profundidad.
4. El portero deberá tomar la decisión de salir a despejar el balón, blocar o aguantar y generar un 1x1.
La situación 5, es un balón que ha conseguido controlar el delantero y se genera una acción de uno contra uno.
La situación 6, es un balón en el que el portero llega antes que el delantero y decide despejar el balón mediante un golpeo con el pie.
El portero no podrá entrar en la zona marcada por conos hasta que se realiza en pase.";;LECTURA DEFENSIVA;Portería competición;10;BALONES , CHINOS;
PORTEROS;INFANTIL , ALEVIN , BENJAMIN;EJERCICIO LECTURA DEFENSIVA (5);"Montaremos una línea defensiva con cuatro compañeros que realizarán tareas de laterales y centrales. El entrenador de porteros realizará la función de iniciar el juego y dar el último pase. Otro compañero realizará las funciones de interior ofensivo, que iniciará un desmarque dirección portería cuando el entrenador de porteros tenga el balón. 
El portero tendrá que decidir si realizar una salida y despejar el balón antes que el interior logre controlar, o por el contrario, aguantar la posición y generar un 1 contra 1. P3 y P4 realizarán un movimiento de ayuda para defender la portería.
ATENCIÓN:
Debemos fijarnos en la toma de decisiones del portero, si está decidiendo bien o mal, si hay algún fallo de concepto… Pensar también en las condiciones técnico-tácticas del portero que trabaja y no en lo que haríamos nosotros, cada portero tiene unas características que debe aprovechar. (Hay porteros más rápidos, más atrevidos, más conservadores…)";;LECTURA DEFENSIVA;Portería competición;10;BALONES , CHINOS;
PORTEROS;INFANTIL , ALEVIN , BENJAMIN;EJERCICIO LECTURA DEFENSIVA (6);"Montamos un campo para realizar una batalla entre porteros, pero en vez de colocar dos porterías, colocaremos  4 como muestra el dibujo. 
Entre la portería principal y la de atrás, podemos dejar unos 5 metros. A cada lado del campo, el portero tendrá un apoyo, con el que podrá jugar cada vez que se produzca un rechace. 
Consiste en realizar una batalla entre porteros en la que, cada vez que un portero no bloque el balón y quede dentro del campo, el portero que ataca deberá hacer gol en la portería de atrás, y podrá ayudarle el compañero de apoyo situado fuera del campo. 
Una vez finalizada esta acción, los dos se colocarán en las porterías principales y comienzan de nuevo.";;LECTURA DEFENSIVA;Portería competición;10;BALONES , CHINOS;
PORTEROS;INFANTIL , ALEVIN , BENJAMIN;SAQUE CON  LA MANO (1);Situados junto al palo, realizar un saque con la mano por arriba a un compañero situado en el vértice del área grande (dependiendo de la edad de los porteros).  Tras esta acción, el portero realiza un ejercicio de velocidad (zig-zag) mientras que el compañero, realiza un control y otro zig-zag esquivando los conos. Al terminar dichas acciones, se encontrarán en un 1x1. Si el portero logra hacerse con el balón, realiza un saque raso a una mini portería. El que ha trabajado de portero, pasa a realizar el ejercicio de atacante y viceversa.;;SAQUE CON LA MANO;Portería competición;10;BALONES , CHINOS , VALLAS;
PORTEROS;INFANTIL , ALEVIN , BENJAMIN;SAQUE CON  LA MANO (2);"El portero realiza un saque raso con la mano que deberá pasar por dentro de las 4 vallas y llegar al entrenador de porteros.
Tras el saque, realizará 4 saltos por encima de las vallas y se posicionará para un lanzamiento del entrenador.
Realiza un blocaje frontal con caída hacia adelante y posteriormente, inicia el juego con un saque a una mini portería.";;SAQUE CON LA MANO;Portería competición;10;BALONES , CHINOS , VALLAS;
PORTEROS;INFANTIL , ALEVIN , BENJAMIN;SAQUE CON  LA MANO (3);"El Entrenador de porteros realiza un disparo al portero situado en la portería. Este realiza un blocaje. 
Al mismo tiempo del golpeo, 2 porteros inician una carrera sobre el área grande pasando por detrás de 1 mini portería. Uno de ellos conducirá un balón y el otro no. 
El portero que trabaja en portería, bloca el disparo y realiza un saque con la mano a la mini portería del compañero que no lleva el balón. Rápidamente, corrige posición para blocar un disparo que realizará el otro compañero que salió conduciendo el balón. 
El portero bloca de nuevo y vuelve a realizar otro saque con la mano a la mini portería.";;SAQUE CON LA MANO;Portería competición;10;BALONES , CHINOS;
PORTEROS;INFANTIL , ALEVIN , BENJAMIN;SAQUE CON  LA MANO (4);El entrenador de porteros centra un balón aéreo, el portero bloca y realiza un saque a marcar gol en una de las 4 mini porterías. Estas 4 porterías son defendidas por 2 porteros, que, si consiguen blocar el saque, tendrán opción a réplica y poder marcar gol en la portería grande.;"Podemos modificar tanto la distancia entre porterías como el tamaño de las mismas. También, la distancia del entrenador del portero marcará dificultad en el ejercicio. Si no bloca balón aéreo, puede haber un disparo de uno de los porteros.";SAQUE CON LA MANO;Portería competición;10;BALONES , CHINOS;
PORTEROS;INFANTIL , ALEVIN , BENJAMIN;UNO CONTRA UNO (1);El portero (P1) que inicia en la portería, realiza un saque a balón parado sobre un compañero (P2) situado fuera del área.  Tras el pase, el portero se ofrece para darle ayuda en la salida del balón, el compañero se la cede y realizará un golpeo medio a otro compañero (P3) situado en el lado opuesto.  Tras el pase en corto, el compañero (P2) que recibió el primer pase, tendrá que defender la portería al borde del área.  Ataque entre P3 y otro compañero P4.;;1x1;Portería competición;10;BALONES , CHINOS;
PORTEROS;INFANTIL , ALEVIN , BENJAMIN;UNO CONTRA UNO (2);"El portero (P1) que trabaja en portería inicia el ejercicio con un saque de media bolea a un compañero (P3) situado a la altura de los banquillos. 
Este realiza un control y se enfrenta en un dos contra uno a un portero (P2)  situado en la portería de picas a la altura del borde del área. Su compañero será P4, apoyo para realizar alguna acción combinada para superar la primera portería. 
El atacante que consiga superar a P2 conduciendo el balón, se enfrentará en un uno contra uno en la portería principal.";;1x1;Portería competición;10;BALONES , CHINOS , PICAS;
PORTEROS;INFANTIL , ALEVIN , BENJAMIN;UNO CONTRA UNO (3);"1. El portero que trabaja en portería inicia el ejercicio con un pase raso a un compañero situado al borde del área, junto a una mini portería. El portero tendrá dos opciones de pase, a un lado o al otro.
2. El compañero que recibe el pase, realiza un control y avanza con él para generar un 1x1. 
3. Si el portero logra quitarle el balón, realiza un saque con la mano a una de las dos mini porterías situadas en la frontal del área.
4. El compañero que se encuentra situado entre las mini porterías será el encargado de evitar que el portero meta gol, pudiendo iniciar la carrera para posicionamiento en el momento que el portero roba el balón en el 1x1.
5. Si logra realizar un blocaje en una de las dos mini porterías, tendrá opción de realizar otro ataque de 1x1 a la portería de fútbol 11, y así, finalizará el ejercicio.";;1x1;Portería competición;10;BALONES , CHINOS;
PORTEROS;INFANTIL , ALEVIN , BENJAMIN;UNO CONTRA UNO (4);"1. El portero realiza un pase raso lateral a un compañero situado fuera del área.
2 y 3. Este controla el balón y vuelve a realizar un pase raso a un compañero situado a unos metros de la frontal del área. El portero que trabaja el ejercicio, deberá situarse en posición para afrontar un 1x1.
4. Si el compañero decide conducir el balón y entrar entre los dos conos situados al borde del área, el portero deberá defender la portería de fútbol 11 situada a su espalda.
5. Si el compañero decide conducir el balón y pasar por fuera de los conos, se dirigirá a marcar gol en una de las mini porterías situadas a ambos lados. El portero deberá evitar que dicho compañero meta gol prácticamente conduciendo el balón.";;1x1;Portería competición;10;BALONES , CHINOS;
PORTEROS;INFANTIL , ALEVIN , BENJAMIN;UNO CONTRA UNO (5);"Montaremos un campo de dimensiones aproximadas de 10mx6m, con dos mini porterías o simplemente con conos. 
Dos porteros trabajan el uno contra uno dentro del campo intentando marcar gol uno a otro y dos porteros fuera darán apoyos al primer toque.  
Partidos de 1 minuto. Se queda jugando el que gana.

ATENCIÓN:
Procurar que sea dinámico, que realicen muchos unos contra uno. Sólo es un minuto pero es bastante exigente si lo tomamos en serio. Adversario muy cerca del portero, así que centro de gravedad del portero que trabaja muy bajo.";;1x1;Portería competición;10;BALONES , CHINOS;
PORTEROS;INFANTIL , ALEVIN , BENJAMIN;UNO CONTRA UNO (6);"El portero que inicia el ejercicio situado en portería P1 realiza un pase con el interior al entrenador de porteros EP. 
Rápidamente, este pasa el balón a otro portero P2 que tendrá tres opciones de ataque. 
Si decide pasar conduciendo el balón por fuera de los conos, intentará entrar conduciendo en una de las mini porterías colocadas a ambos lados. 
Si decide entrar conduciendo el balón entre los conos, realizará un uno contra uno en portería de F11.";;1x1;Portería competición;10;BALONES , CHINOS , PORTERIA PEQUEÑA;
PORTEROS;INFANTIL , ALEVIN , BENJAMIN;JUEGO CON  LOS PIES (1);Los dos porteros se sitúan uno enfrente de otro, dentro de sus porterías de picas.  Uno tendrá el balón en los pies y el otro sin balón. El ejercicio comienza cuando el portero que posee la pelota, realiza un pase raso a su compañero, este avanza, pasa por dentro de las picas y devuelve el balón con un golpeo raso al primer toque. Tras este golpeo, realiza una carrera hacia atrás pasando entre dos conos y volviendo a entrar entre las picas. El otro compañero, deberá realiza un segundo golpeo para que el portero ejecute un blocaje raso con caída lateral.  Se vuelve a realizar por el otro lado y sin tiempo de parada, con el mismo balón del blocaje, se inicia para que lo realice el compañero de enfrente.;;JUEGO DE PIES;10x10;10;BALONES , CHINOS , PICAS , PORTERIA PEQUEÑA;
PORTEROS;INFANTIL , ALEVIN , BENJAMIN;JUEGO CON  LOS PIES (2);"Un portero (P2) realiza un pase al portero que trabaja situado en portería (P1). Este devolverá golpeando al primer toque, y realizará un desplazamiento hacia el otro lado para blocar un balón aéreo lanzado por el entrenador de porteros (EP). 
Tras el blocaje, realiza un saque de volea a otro compañero situado aproximadamente a la altura de los banquillos.";;JUEGO DE PIES;10x10;10;BALONES , CHINOS;
PORTEROS;INFANTIL , ALEVIN , BENJAMIN;JUEGO CON LOS PIES (3);"El entrenador de porteros (EP) realiza un pase al portero que realiza el ejercicio (P1). P1 controla y hace un pase al compañero (P2). 
Este conduce el balón hasta línea de fondo y realiza un centro al área. P1 bloca el balón y avanza unos metros para colocarse en una buena situación para realizar el saque.";;JUEGO DE PIES;10x10;10;BALONES , CHINOS;
PORTEROS;INFANTIL , ALEVIN , BENJAMIN;ENTRENAMIENTO COMPETITIVO (1);"Ejercicio por parejas. Una pareja defenderá la pica colocada a 3-5 metros del lugar del blocaje (según la edad de los porteros) y la otra pareja, intentará tirarla desde una distancia de 6-8 metros (según la edad de los porteros). 
El ejercicio se inicia con un golpeo de balón al entrenador de porteros desde unos 3 metros por detrás de las picas, velocidad hasta las picas y blocaje tras el lanzamiento del entrenador. En el momento que el portero suelte el balón que ha blocado, ya puede golpear el portero de la pareja contraria. 
El portero que defiende deberá realizar un desplazamiento lateral y estirada para desviar o blocar el balón lanzado.
Por cada pica que tire la pareja, suma un punto.
Número de golpeos: 10.";;ENTRENAMIENTO COMPETITIVO;10x10;10;BALONES , CHINOS , PICAS;
PORTEROS;INFANTIL , ALEVIN , BENJAMIN;ENTRENAMIENTO COMPETITIVO (2);"Ejercicio por parejas. Un portero de cada equipo en la portería y el otro miembro de la pareja a uno de los campos situados en los lados. 
Uno de los porteros inicia el juego con un lanzamiento a puerta. En cada disparo a puerta existen 5 posibilidades:
- Si el portero bloca el disparo: lanzará a gol con la mano
- Si el portero desvía hacia su compañero y no sale el balón de la zona marcada: este puede devolver el balón raso y golpear al primer toque.
- Si el portero desvía al campo contrario y no sale de la zona marcada: este pasará raso a su compañero que volverá a lanzar a puerta al primer toque.
- Si el portero desvía y sale de la zona marcada: podrá golpear a puerta a balón parado.
- Si es gol: se reanudará el juego con un saque de semi-volea";;ENTRENAMIENTO COMPETITIVO;10x10;10;BALONES , CHINOS , PICAS;
PORTEROS;INFANTIL , ALEVIN , BENJAMIN;ENTRENAMIENTO COMPETITIVO (3);"Montaremos una portería con dos picas, de aproximadamente5 metros y situamos 6 balones a ambos lados. Igualmente, se colocaran dos porteros, uno en cada pica, que tratarán de defender el perfil de la portería que les toque cada vez.
El objetivo del juego es que durante la ronda de tiros a la portería de picas, uno de los dos porteros logre alcanzar al otro situado en el lado opuesto de la portería, eso se conseguirá realizando el ejercicio a mayor velocidad.";;ENTRENAMIENTO COMPETITIVO;10x10;10;BALONES , CHINOS , PICAS;
PORTEROS;INFANTIL , ALEVIN , BENJAMIN;ENTRENAMIENTO COMPETITIVO (4);"Cuando el entrenador marca el inicio del ejercicio, dos porteros comienzan a la vez, uno será el encargado de marcar gol y otro de pararlo. 
El que realiza el disparo a puerta, deberá superar un trabajo de frecuencia con aros y saltos en vallas pequeñas. El portero que tendrá que detener el disparo, se enfrenta a un zig-zag y salto de vallas. 
El trabajo se convierte en una rueda.";;ENTRENAMIENTO COMPETITIVO;10x10;10;AROS , BALONES , PICAS , VALLAS;
