TIPO;CATEGORIA;TAREA;DESCRIPCIÓN;VARIANTES;OBJETIVO;ESPACIO;TIEMPO TOTAL;MATERIAL;VIDEO DRIVE ID
ACCIONES COMBINADAS;SENIOR , JUVENIL , CADETE , INFANTIL;DOBLE 2x1 + CENTRO Y REMATE;Jugamos 3 rojos frente a 3 azules, se dan unos pases hasta que el balón llega al jugador que inicia y se juegan en dos espacios diferentes un 2x1, cuando acaban los que están más cerca de la portería grande, tienen que atacar y defender un centro lateral de cada lado.;;BUSCAR SUPERIORIDADES;1/2 Campo;20;BALONES , CHINOS , PETOS , PORTERIA PEQUEÑA;https://drive.google.com/file/d/1PevflpuY-IvNf1Xo0x6eUayauDqsdzlp/view?usp=share_link
ACCIONES COMBINADAS;SENIOR , JUVENIL , CADETE , INFANTIL , ALEVIN;REDUCIDO 2x1 + ATAQUE 2x2;Se inicia en los campos pequeños un 2x1, cuando hay gol o el balón sale fuera, se inicia un 2x2 siendo los atacantes los jugadores azules y los defensores los jugadores rojos que salen del fondo de la portería.;;ATAQUE RAPIDO;1/2 Campo;20;BALONES , CHINOS , PETOS , PORTERIA PEQUEÑA;https://drive.google.com/file/d/1PetimjNc2QYpMabpXSTgQcA6TKSxPn0m/view?usp=share_link
RONDO;CADETE , INFANTIL , ALEVIN;RONDOS 4x1 + FINALIZACIÓN;Jugamos unos rondos 4x1 en los espacios pequeños, cuando se dan 5 pases o hay un robo, los jugadores que estaban robando, tienen que finalizar dos disparos cada uno, uno de cada perfil.;Si vemos que los jugadores que roban no están poniendo todo para robar al finalizar si o si, poner la norma de que si no roban no finalizan.;FINALIZAR;1/2 Campo;20;BALONES , CHINOS , PETOS;https://drive.google.com/file/d/1PlX6jGsxGfqw7FkJQzKimhLyXaaNtNIh/view?usp=share_link
JUEGO DE FÚTBOL;INFANTIL , ALEVIN;SAQUE DE BANDA;Iniciamos con un saque de banda al jugador que ataca de espaldas a portería, el defensor, no puede anticipar. Tiene que evitar que el atacante se gire y consiga sobrepasar la línea ver (tiene que realizar un centro al compañero) o la línea amarilla (finaliza él ante el portero). Si el defensor consigue robar, tiene que cruzar la línea roja.;;SAQUE DE BANDA;Doble Area;15;BALONES , CHINOS , PETOS;https://drive.google.com/file/d/1TxASTVzLULcl5cWV_k56ojN3EI-qXwI3/view?usp=share_link
JUEGO LÚDICO;ALEVIN , BENJAMIN , PREBENJAMIN , SALA;4 ESQUINAS;Jugamos cada uno con un balón. Se va conduciendo por la zona delimitada. A la señal del entrenador, hay que ocupar los conos puestos en el espacio. Los que no ocupen un cono, tienen un punto negativo, el que más consiga pierde.;;CONDUCCIÓN;40x25;10;BALONES , CHINOS;https://drive.google.com/file/d/1Tr24CvDIN0wfVXLqHRgmca0NYIOHcXWD/view?usp=share_link
JUEGO LÚDICO;BENJAMIN , PREBENJAMIN , SALA;ARAÑA TRIPLE;Jugamos a la araña, pero con tres zonas de paso. Los jugadores con balón, tendrán que superar las 3 zonas para conseguir volver a iniciar el paso en sentido inverso. Los 3 que roban, lo harán a tiempo, y tendrán que conseguir que los jugadores con balón no pasen de lado a lado.;;VELOCIDAD;Ir variando conforme se van eliminando jugadores;20;BALONES , CHINOS;https://drive.google.com/file/d/1TqcGJyGi2iG3T092zlMpgaIJu4RDmHef/view?usp=share_link
JUEGO LÚDICO;INFANTIL , ALEVIN , BENJAMIN;DEFENSA EN PAREJA;Jugamos por parejas, los jugadores que atacan tendrán que superar a los dos jugadores defensores pasando entre los conos marcados. Tienen que llegar a la zona azul.;;BUSCAR SUPERIORIDADES;40x25;15;BALONES , CHINOS , PETOS;https://drive.google.com/file/d/1TrnWfdSNtZVr6uo9lOIrSVzqKKT8Gf8z/view?usp=share_link
JUEGO LÚDICO;BENJAMIN , PREBENJAMIN , SALA;EL COMECOCOS;Marcos un circuito (a gusto de cada uno) con chinos. Los jugadores tendrán que conducir el balón entre las líneas imaginarias que forman los chinos sin ser pillados por los jugadores que no tienen balón y que también se mueven por las líneas imaginarias.;;CONDUCCIÓN;1/2 Campo;15;BALONES , CHINOS , PETOS;https://drive.google.com/file/d/1Tvt_X0NX9UcMmYnKOTrLDYyqgB9_RuVw/view?usp=share_link
JUEGO LÚDICO;BENJAMIN , PREBENJAMIN , SALA;ROBAR BALONES;Jugamos por equipos, cada equipo tendrá que robar balones al rival de su zona, pasando por la zona de regate, donde el rival tendrá que evitar que los rivales progresen y se lleven sus balones. Si algún defensor roba un balón, lo tendrá que volver a dejar en su zona.;;COOPERACIÓN;40x25;10;BALONES , CHINOS , PETOS;https://drive.google.com/file/d/1TufJkRsyF_PgbJ04c8lggWu8W_vJhX8m/view?usp=share_link
JUEGO LÚDICO;ALEVIN , BENJAMIN;SUPERAR 1x1;Hay 3 zonas de regate (1x1) el jugador que inicia tiene que ir superando cada zona hasta llegar al área para finalizar con un disparo a portería. Si un defensor consigue robar el balón, él es el que sigue intentando llegar al área y el atacante se quedará en la zona que no ha superado para defender el 1x1.;;1x1;1/2 Campo;20;BALONES , CHINOS;https://drive.google.com/file/d/1TwHWILg6bxuZWK2dIB6akvNYo9TLzphn/view?usp=share_link
ACCIONES COMBINADAS;SENIOR , JUVENIL , CADETE , INFANTIL , ALEVIN;ATAQUES POR TRIOS;Jugamos por tríos. Se inicia con 1x0 con disparo a portería, despues se juega un 2x1 y se acaba en un 3x2. Cuando se acaba, se cambian de rol los equipos.;;ATAQUE RAPIDO;1/2 Campo;20;BALONES , CHINOS , PETOS , PORTERIA PEQUEÑA;https://drive.google.com/file/d/1pbEPuffxAM5LCC4QE1APqiSVDwvwWkGG/view?usp=share_link
EVOLUCIONES;SENIOR , JUVENIL , CADETE , INFANTIL , ALEVIN;FINALIZACIONES COMBINATIVAS;Iniciamos con un disparo a portería, segundo ataque, se pasan balón entre jugador 2 y 3, para realizar dos disparos desde los dos perfiles, por último, hay un centro y entran los 3 jugadores al remate.;;FINALIZAR;1/2 Campo;20;BALONES , CHINOS , PETOS;https://drive.google.com/file/d/1kHV_UGIN0WewSu75rY89OgPKSJ1DzMxu/view?usp=share_link
EVOLUCIONES;SENIOR , JUVENIL , CADETE , INFANTIL , ALEVIN;FINALIZACIONES POR EQUIPOS;Jugamos por equipos, realizamos la secuencia de disparos a portería para conseguir 10 goles. El equipo que antes los consiga gana.;;FINALIZAR;1/2 Campo;20;BALONES , CHINOS , PETOS;https://drive.google.com/file/d/1Jy3qQf4nNIotTkPdGO9xqwkbViDQhB9T/view?usp=share_link
TÉCNICA INDIVIDUAL;PREBENJAMIN , SALA;CIRCUITO 1;Conos colocados a 5 mts. como muestra el dibujo para realizar: Conducción distancia larga. Cada jugador con su balón, conduce entre conos y vuelta a la fila. Pases. Un jugador en cada cono (2 en el inicio). El 1o con balón pasa al 2o (control + pase) y va a ocupar su lugar, así sucesivamente. Pase y pisada. Por parejas: el 1o con balón pasa al 2o que pisa el balón (y va a sprint al siguiente cono) para que venga el jugador 1o. Pase + finalización. Por parejas: el 1o con balón pasa al 2o y se mueve lateralmente al siguiente cono para recibir pase del 2o, así hasta el último cono donde el 1o continúa conduciendo para realizar pase al centro al 2o que finaliza.;;CONDUCCIÓN;10x20;20;BALONES , CHINOS;
TÉCNICA COLECTIVA;PREBENJAMIN , SALA;CIRCUITO 2;Por parejas a una distancia de 10m. Pasarse el balón entre los dos, alternando de pierna de golpeo. Los  jugadores deberán tener en cuenta cuando realizar el pase para que no  colisione con el jugador que pasa por medio en conducción en velocidad.;;PASE;10x20;15;BALONES , CHINOS;
TÉCNICA COLECTIVA;PREBENJAMIN , SALA;CIRCUITO 3;Jugadores en grupos de 4.  Rueda de pases: a)   Jugador que inicia jugada nº 1 pasa frontal a nº 2 (separado del cono). b)   Jugador nº 2 controla y devuelve pase a nº1 (separado del cono). c)   Jugador nº 1 controla y pasa diagonal a nº 3 (separado del cono). d) Jugador nº 3 controla y pasa a nº 2 (separado del cono por el otro lado). e) Jugador nº 2 controla y pasa a nº 3 (separado del cono por el otro lado). f)    Jugador nº 3 controla, conduce y finaliza.;;PASE;1/2 Campo;15;BALONES , CHINOS;
TÉCNICA INDIVIDUAL;PREBENJAMIN , SALA;CIRCUITO 4;Jugadores en grupos de 3. Jugador nº 1 realiza pase a jugador nº 2. que se aleja del cono para recibir  pase, controla y conduce hacia el cono central y, de allí, al cono del borde  del área, para realizar un regate y finalizar.;;CONDUCCIÓN;1/2 Campo;15;BALONES , CHINOS;
TÉCNICA INDIVIDUAL;PREBENJAMIN , SALA;PASE + CONDUCCIÓN EN FILAS;Jugadores en fila india sin balón. Jugador sale, realiza circuito en aros (saltos variados), realiza movimiento en  conos (delante, derecha, izquierda, detrás) y sale hacia balón. Cuando llega,  realiza pase frontal a jugador, que controla y conduce hasta dejar el balón  con pisada en la posición inicial.  El jugador que ha empezado el circuito, tras realizar pase, sprint hacia cono  frontal. El jugador que termina la jugada, va la fila de inicio.;;PASE;20x5;10;AROS , BALONES , CHINOS;
ACCIONES COMBINADAS;PREBENJAMIN , SALA;RUEDA PASES - SALIDA DE BALÓN;3 jugadores para salida de balón (azules) y 2 defendiendo (rojo). Cuando  azules sacan balón deben estar cada uno en su zona (bien abiertos) y  circular el balón de una banda a otra generando superioridad de 2 contra 1.  El objetivo en progresar y marcar en una de las tres porterías de conos.  Si los jugadores rojos roban balón, atacan y finalizan jugada en portería azul  (defendida por portero). Azules, en el momento que pierden balón, repliegan  y se cierran pudiendo abandonar las zonas laterales.;;PROGRESAR;1/2 Campo;15;BALONES , CHINOS , PETOS , PORTERIA PEQUEÑA;
TÉCNICA INDIVIDUAL;PREBENJAMIN , SALA;CIRCUITO 7;Jugadores en 2 grupos.  Carrera de relevos: a)   Primero sin balón. Salir al cono rojo, dar relevo chocando la mano con el  siguiente compañero, que sale al cono verde y el tercero al cono azul. b)   Igual que antes, pero con balón en la mano. (no vale tirar el balón). c)   Mismo ejercicio pero conduciendo el balón con el pie. (no tirarlo).;;CONDUCCIÓN;20x10;10;BALONES , CHINOS;
TÉCNICA INDIVIDUAL;PREBENJAMIN , SALA;CIRCUITO 8;Jugadores divididos en dos grupos, cada uno en esquina contraria diagonal. Los dos grupos realizan el mismo circuito a la vez: Inicia jugador realizando conducción, realiza pase corto a entrenador (se  queda el balón). Después saltos sobre vallas y trabajo de piernas en aros  (variedad de saltos). Posteriormente, sprint hasta la esquina (tocar el cono  con la mano) y recibir pase largo del entrenador. Control de balón y  devolución de balón a entrenador (pase largo raso). Por último, sprint a  recibir pase de entrenador para poder finalizar.;;CONDUCCIÓN;20x40;15;AROS , BALONES , CHINOS , CONOS , VALLAS;
TÉCNICA COLECTIVA;PREBENJAMIN , SALA;CIRCUITO 9;Grupo azul- sprint 20 metros, desplazamiento hacia el balón, conducción 2  toques y chute a portería antes de llegar a línea de 10 metros. A la vez, portero pasa balón a jugador rojo, conduce máximo de 2 toques y  pasa en diagonal a jugador azul. Los porteros cada 5 acciones hacen cambio de portería. El entrenador delimita el espacio al jugador pasador y señala los inicios de  cada acción.;;PROGRESAR;20x40;15;BALONES , CHINOS;
ACCIONES COMBINADAS;PREBENJAMIN , SALA;CIRCUITO 10;A la señal del entrenador, reaccionan los 2 porteros y los dos jugadores de  las esquinas. Porteros en sprint hasta cono y vuelta a su área para coger el balón y  realizar un pase rápido con la mano al jugador de la esquina, que a la vez ha  salido a sprint.  El jugador receptor controla, conduce y define delante del portero.;;FINALIZAR;20x40;15;BALONES , CHINOS;
TÉCNICA INDIVIDUAL;PREBENJAMIN , SALA;CIRCUITO 11;A la señal del entrenador, un jugador de cada equipo sale rápido para saltar  4 vallas a pies juntos, continúan a sprint realizando un giro completo, salen  del giro a sprint y buscan el balón para conducirlo con 3 toques máximo y  chutar contra la portería entre los conos. No pueden chutar después de los  conos que forman una línea imaginaria a 10 metros.  Una vez terminado recogen su balón y se cambian de fila. Los porteros se intercambian cada acción.;;VELOCIDAD REACCIÓN;40x20;15;BALONES , CHINOS , PICAS , VALLAS;
TÉCNICA COLECTIVA;PREBENJAMIN , SALA;CIRCUITO VELOCIDAD + 1x1;A la señal del entrenador, reaccionan los jugadores números 1 inician y van  a sprint hasta medio campo, giran al primer y al segundo cono para controlar  el balón que viene del jugador número 2 de la esquina.  El jugador 2 (pasador) pasa a ser defensa y se crea un 1x1. Los jugadores 1, una vez finalizada la acción pasan a la fila de pasadores y  los jugadores 2 (pasadores) pasan a la fila de finalizadores.;;REGATE;40x20;20;BALONES , CONOS;
JUEGO LÚDICO;PREBENJAMIN , SALA;PERSEGUIR CON BALÓN;Jugadores en 2 grupos. Conos separados 10 mts y + 4mts. a)  Un grupo con 2 balones. Jugador nº 4 a la señal del entrenador conduce balón hasta  el primer cono y regresará lo más rápido posible a la posición de salida. A la vez  saldrá conduciendo jugador nº1 he intentará “pillar” a su compañero. b)  Grupo sin balones. Mismo ejercicio que el anterior pero sin balón. Todo a sprint.;;CONDUCCIÓN;14x10;10;BALONES , CHINOS;
TÉCNICA INDIVIDUAL;PREBENJAMIN , SALA;CONDUCCIÓN 3-4 ESQUINAS;Jugadores en pareja, un balón por pareja. Dos jugadores en cada uno de los chinos que están en  las esquinas   exteriores del triángulo o cuadrado (depende nº de jugadores).  El jugador sale conduciendo el balón hacia su cono interior del triángulo o  cuadrado, lo rodea y vuelve conduciendo hasta dejarle el balón a su  compañero.;;CONDUCCIÓN;20x20;15;BALONES , CHINOS;
TÉCNICA COLECTIVA;PREBENJAMIN , SALA;CONDUCCIÓN + PASE (ESQUINAS);Jugadores en pareja, un balón por pareja. Dos jugadores en cada uno de los chinos que están en  las esquinas   exteriores del triángulo o cuadrado (depende nº de jugadores).  El jugador sale conduciendo el balón hacia su cono interior del triángulo o  cuadrado, lo rodea y da un pase largo al  jugador que está en el chino  exterior de su derecha. Tras el pase se mueve a ese chino de la derecha.;;CONDUCCIÓN;20x20;15;BALONES , CHINOS;
TÉCNICA INDIVIDUAL;PREBENJAMIN , SALA;CONDUCCIÓN (ir a los chinos);Todos los jugadores con un balón.  En espacio reducido, individualmente conducir libremente.  Al oír la señal “salir” cada uno va hacia un chino (que estarán fuera del  espacio de trabajo)  conduciendo su balón y allí al lado del chino se debe  pisar el balón con la planta del pie. Se irá quitando un chino tras cada jugada. Así hasta que sólo quede un  jugador;;CONDUCCIÓN;10x5;15;BALONES , CHINOS;
TÉCNICA INDIVIDUAL;PREBENJAMIN , SALA;CONDUCCIÓN (circuito);En varios grupos A, B y C (en filia india), sale un jugador de cada grupo con  el balón, y realiza el circuito: zig-zag entre picas, giro completo sobre como,  conducción entre chinos, pisar el balón en el último cono y vuelta por el  lateral conduciendo el balón a más velocidad. Al acabar  chocará con la mano al compañero para darle el relevo, el cual  iniciará el circuito. Así hasta que todos los jugadores del grupo completen el circuito.;;CONDUCCIÓN;30x20;15;BALONES , CHINOS , CONOS , PICAS;
TÉCNICA INDIVIDUAL;PREBENJAMIN , SALA;CONDUCCIÓN + FINALIZACIÓN;Todos los jugadores con un balón.  Divididos en 2 grupos  A y B (en fila india), cada jugador realiza una  conducción hacia los conos (separados 3 mts.), tras superar el último cono  realiza disparo (a la altura del chino), una vez con la izquierda y otra con la  derecha. Después del tiro, recoge su balón y lo lleva con el pie hasta su fila. En un grupo disparo con portero, en el otro puntería a conos.  Cambio de grupo tras dos rondas cada niño (una ronda con la izda. y otra  con la dcha.).;;CONDUCCIÓN;40x20;10;BALONES , CHINOS , CONOS;
TÉCNICA COLECTIVA;PREBENJAMIN , SALA;CONDUCCIÓN Y PASE;Todos los jugadores divididos en dos grupos A y B.  Se sitúan 5 conos en perpendicular a 2 filas de jugadores. Saliendo un balón de cada lado los jugadores (saliendo del chino) deberán  realizar una conducción entre conos desde el centro a uno de los extremos y  vuelta finalizando con un pase raso a la fila contraria de la que salió. Tras realizar el pase, el jugador va a la fila contraria.;;CONDUCCIÓN;30x15;10;BALONES , CHINOS , CONOS;
TÉCNICA INDIVIDUAL;PREBENJAMIN , SALA;CONDUCCIÓN (ROBA BALONES);Todos los jugadores (menos 1, que tendrá un peto en la mano) con un balón  dentro del área (opción A) (o zona delimitada, medio campo - opción B)  En el espacio, conducen libremente mientras un jugador espera fuera del  área. A la señal del entrenador este jugador entra a “robar”  y tirar todos los  balones de los compañeros en el menor tiempo posible. Los jugadores con balón deberán proteger su balón y aguantar el mayor  tiempo posible. Después, cambio de jugador que roba balones.;;CONDUCCIÓN;20x20;10;BALONES , PETOS;
TÉCNICA INDIVIDUAL;PREBENJAMIN , SALA;CONDUCCIÓN (variedad);Todos los jugadores con un balón (fila india). Divididos en dos grupos. Deben  realizar un circuito de conducción dividido en:  A: Conducción interior – interior.  B: Conducción con el exterior. C: Conducción con la planta del pie. D: Conducción con la planta del pie pero hacia atrás (de espaldas). E: Conducción, REGATE (gesto técnico) al chino  y TIRO (portero y/o conos) Tras realizar el circuito, el jugador coge el balón y vuelve a la fila.;;CONDUCCIÓN;7x7;20;BALONES , CHINOS , CONOS;
JUEGO LÚDICO;PREBENJAMIN , SALA;CONDUCCIÓN (pañuelo);Todos los jugadores (divididos en dos grupos) Juego del pañuelo pero con balón. Cuando el entrenador diga un número saldrá un jugador de cada equipo  Consiste en coger el balón y conducirlo sin que el otro jugador le quite el  balón hasta atravesar la línea de partida. El jugador que pierda seguirá jugando (tras dar una vuelta).;;CONDUCCIÓN;8x8;10;BALONES , PETOS;
TÉCNICA INDIVIDUAL;PREBENJAMIN , SALA;CONDUCCIÓN (Que no te pillen);Jugadores divididos en tríos. El jugador de la mitad intenta conducir hacia la portería. Los otros 2 jugadores (primero puede salir solo uno) saldrán al mismo tiempo  e intentarán alcanzarlo antes de que llegue a tirar. Sólo se puede tirar a partir del chino. Tras realizar el ejercicio, el jugador coge el balón y vuelve a la fila. Tras 2 rondas, se cambian las filas.;;CONDUCCIÓN;20x20;10;BALONES , CHINOS;
TÉCNICA COLECTIVA;PREBENJAMIN , SALA;CONDUCCIÓN (Control orientado);ugadores colocados en los chinos (ver dibujo): A, B y C. Pase frontal entre 2 jugadores: Inicia A pasa a B. Una vez realizado el pase  B realiza un control orientado y conduce rápido en dirección a portería. El poseedor del balón (B) intentará llegar antes de que su compañero (C) le  coja. El jugador que persigue (C) saldrá en el momento en el que su  compañero (B) recibe el pase del A. Tras finalizar rotan: A va sitio de C, C a sitio de B, B recoge el balón y va A  para iniciar la jugada de nuevo.;;CONDUCCIÓN;20x20;10;BALONES , CHINOS;
TÉCNICA INDIVIDUAL;PREBENJAMIN , SALA;CONDUCCIÓN (Relevos);La mitad de los jugadores de cada equipo se colocan enfrente de los otros y  a una distancia de uno 15 metros  A mitad de camino se colocan 2 conos Se trata de conducir rápidamente desde uno de los lados hacia el otro.  Una vez que el jugador en conducción pasa la línea marcada por los conos  puede salir el siguiente jugador que recoge el balón y así sucesivamente.  Primero sin competir. Después, ganará el equipo cuyo último hombre cruce  antes la línea de meta.;;CONDUCCIÓN;20x15;15;BALONES , CHINOS , PETOS;
TÉCNICA INDIVIDUAL;PREBENJAMIN , SALA;CONDUCCIÓN (Obstáculos);Jugadores divididos en dos grupos de 5, todos con balón. En una zona delimitada por  4 conos se colocarán 5 jugadores, un balón por  jugador y 5 conos. Consiste en conducir el balón a través del cuadrado sorteando los conos  (girando alrededor de un cono y yendo hacia otro, así hasta hacer los 5  conos) y evitando perder el control del balón.;;CONDUCCIÓN;15x15;10;BALONES , CHINOS;
TÉCNICA INDIVIDUAL;PREBENJAMIN , SALA;CONDUCCIÓN (Sorteando conos);Jugadores divididos en dos grupos de 5, todos con balón.  Conducción entre conos, para después realizar un tiro. Tras sortear todos los conos dirigirse a uno de los 2 más alejados para tirar a  portería.;;CONDUCCIÓN;20x20;15;BALONES , CHINOS;
TÉCNICA INDIVIDUAL;PREBENJAMIN , SALA;CONDUCCIÓN (número y tiro);Jugadores divididos en 2 grupos, todos con balón.  Conducir alrededor de una zona para después tirar a puerta. Cada jugador tendrá un número asignado. En una zona próxima al área de penalti los jugadores conducen el balón.  Cuando el entrenador nombre un número éste deberá tirar a portería.;;CONDUCCIÓN;8x8;10;BALONES , CHINOS;
TÉCNICA INDIVIDUAL;PREBENJAMIN , SALA;CONDUCCIÓN (corre que te  persiguen);Jugadores divididos en 2 grupos, todos con balón. Un jugador conduce hasta mitad de campo donde deberá rodear a un pivote  En el momento en el que haya superado el pivote un compañero que está  situado 5 metros detrás saldrá en su busca con la intención de quitarle el  balón antes de que llegue a la zona de tiro;;CONDUCCIÓN;20x10;10;BALONES , CHINOS;
TÉCNICA INDIVIDUAL;PREBENJAMIN , SALA;CONDUCCIÓN (TORPEDOS);Dos líneas formadas por 4-5 jugadores cada una se sitúan a 10 metros una  de la otra. Una de las filas tendrá en su poder todos los balones. El jugador que conduce el balón deberá de hacerlo entre las 2 líneas  procurando que no le desvíen el balón que él mismo conduce Si tiran su  balón , eliminado). Si termina, sale su compañero con balón hacia la otra  dirección (y lanzarán balones los de la fila contraria);;CONDUCCIÓN;15x15;10;BALONES , CHINOS;
TÉCNICA INDIVIDUAL;PREBENJAMIN , SALA;CONDUCCIÓN (RONDOS);Jugadores divididos en 2 grupos, un balón para cada grupo. Cada grupo forma un círculo alrededor del cono central. El jugador que  empieza con el balón dice en voz alta el nombre de un compañero.  Conducirá el balón hasta dicho compañero y le dejará el balón, ocupando su  sitio. El compañero que recibe el balón hace la misma acción nombrando a otro  compañero, dejándole el balón y así sucesivamente.;;CONDUCCIÓN;8x8;10;BALONES , CHINOS;
TÉCNICA INDIVIDUAL;PREBENJAMIN , SALA;CONDUCCIÓN + FINALIZACIÓN  (CONOS COLORES);Jugadores divididos en 2 grupos, todos con balón. Se forma un cuadrado con  conos de diferentes colores (en medio un chino).  El jugador sale del medio campo conduciendo el balón hasta el chino central  del cuadrado. Al llegar, el entrenador indicará un color de uno de los conos  que están las esquinas del cuadrado, el jugador conducirá hasta ese cono,  tocándolo, girando sobre él y rápidamente buscará portería para finalizar   con disparo fuera del área.;;CONDUCCIÓN;20x20;20;BALONES , CHINOS;
TÉCNICA COLECTIVA;PREBENJAMIN , SALA;CONDUCCIÓN (CUADRADO.  VARIANTE PASE);Jugadores divididos en 2 grupos. Donde inicia jugada, dos jugadores. Se forma un cuadrado con los conos. Realizan una conducción hacia el compañero, deja el balón y se queda en su  sitio. Realizar el ejercicio en ambos sentidos.;a mitad de camino dar pase y hacer pared. Tras la pared el  jugador ocupa el sitio del compañero que saldrá conduciendo hacia el  otro cono.;CONDUCCIÓN;7x7;10;BALONES , CHINOS;
JUEGO LÚDICO;ALEVIN , BENJAMIN , PREBENJAMIN , SALA;CAZA BALONES;Jugadores divididos en 2 equipos.  Se hacen 2 círculos con los chinos (uno para cada equipo). Una fila de  balones en el otro extremo del campo, a media distancia un cono. Sale un jugador de cada equipo a sprint, coge un balón y conduciéndolo lo  deposita dentro del círculo, choca la mano con su compañero, que repite la  operación. Cuando no queden balones que coger, el jugador sale al cono  central, giro completo y roba al círculo rival y, con el pie, lo lleva a su círculo.;;;20x20;10;BALONES , CHINOS;
JUEGO LÚDICO;ALEVIN , BENJAMIN , PREBENJAMIN , SALA;CONDUCCIÓN (3 en raya);Jugadores divididos en 2 equipos. Cada jugador con un balón.  Con los aros se hacen dos juegos de 3 en raya (uno para cada equipo).  Sale un jugador de cada equipo a conduciendo un balón, zig-zag, giro  completo y deposita el balón en un aro. Realiza sprint para dar relevo a su  compañero.  Gana el equipo que antes haga el 3 en raya.;Primero se puede hacer con un peto con la mano cada  jugador de los equipos.;CONDUCCIÓN;20x20;10;AROS , BALONES , CHINOS , PETOS;
TÉCNICA INDIVIDUAL;ALEVIN , BENJAMIN , PREBENJAMIN , SALA;CONDUCCIÓN (equipos-chinos);Jugadores divididos en 2 equipos en 2 colores: azul y rojo. Todos con balón.  Los jugadores conducen el balón libremente, hasta que a la señal del  entrenador, deben ir con cada uno con su balón hacia el chino de su color y  juntarse todos los miembros del equipo del mismo color. Ganará el equipo que logre juntar a todos los miembros de su equipo  en el  chino de su color y que tengan el balón en el pie.;los 2 equipos mezclados van corriendo sin balón, a la señal  del entrenador deben  juntarse todos en el chino de su color.;CONDUCCIÓN;15x15;10;BALONES , CHINOS;
TÉCNICA INDIVIDUAL;BENJAMIN , PREBENJAMIN , SALA;CONDUCCIÓN  (conducción + regate);Jugadores en grupos de 4. Jugadores 1 y 1 (uno de cada equipo) salen conduciendo el balón hacia el  cono que tienen a su derecha. Al llegar a ese cono realizan un regate y  siguen conduciendo hacia el siguiente cono (el que está frente a su posición  de salida). Allí dan el relevo al siguiente compañero.;;CONDUCCIÓN;10x10;10;BALONES , CHINOS;
ACCIONES COMBINADAS;ALEVIN , BENJAMIN , PREBENJAMIN , SALA;CONDUCCIÓN  (toma de decisiones);Jugadores en parejas. Jugador nº 1 (rojo)  conduce hasta el cono más lejano (rojo). Una vez llega,  da la vuelta y finaliza en cualquiera de las dos porterías.  A su vez, nada más que el jugador nº 1 llegue al cono, el jugador nº 2  (amarillo) sale conduciendo hacia el cono más cercano (amarillo) para  intentar finalizar en cualquiera de las porterías.  Nada más finalizar jugador nº1 deberá actuar de defensa contra jugador nº2.;;CONDUCCIÓN;15x10;10;BALONES , CHINOS , PORTERIA PEQUEÑA;
